{
  "annotationLayerId": "88888888-8888-4888-8888-888888888888",
  "corpusReleaseId": "22222222-2222-4222-8222-222222222222",
  "annotationFrameworkId": "20202020-2020-4202-8202-202020202020",
  "layerKind": "CLAUSE_STRUCTURE",
  "layerVersion": "fixture-clear-clause-1",
  "sourceRegistryId": "21212121-2121-4212-8212-212121212121",
  "provenanceId": "22222222-aaaa-4222-8aaa-222222222222",
  "rightsPolicyId": null,
  "contentHash": "7777777777777777777777777777777777777777777777777777777777777777"
}
