{
  "annotationLayerId": "77777777-7777-4777-8777-777777777777",
  "corpusReleaseId": "22222222-2222-4222-8222-222222222222",
  "annotationFrameworkId": "39393939-3939-4393-8393-393939393939",
  "layerKind": "MORPHOLOGY",
  "layerVersion": "fixture-oshb-morphology-1",
  "sourceRegistryId": "37373737-3737-4373-8373-373737373737",
  "provenanceId": "40404040-4040-4404-8404-404040404040",
  "rightsPolicyId": null,
  "contentHash": "cdcdcdcdcdcdcdcdcdcdcdcdcdcdcdcdcdcdcdcdcdcdcdcdcdcdcdcdcdcdcdcd"
}
